Admin Level 0,Admin Level 1,Admin Level 2,Admin Level 3,
Bangladesh, Barisal, Barguna, Amtali
Bangladesh, Barisal, Barguna, Bamna
Bangladesh, Barisal, Barguna, Barguna Sadar
Bangladesh, Barisal, Barguna, Betagi
Bangladesh, Barisal, Barguna, Patharghata
Bangladesh, Barisal, Barisal, Agailjhara
Bangladesh, Barisal, Barisal, Babuganj
Bangladesh, Barisal, Barisal, Bakerganj
Bangladesh, Barisal, Barisal, Banari Para
Bangladesh, Barisal, Barisal, Barisal Sadar (Kotwali)
Bangladesh, Barisal, Barisal, Gaurnadi
Bangladesh, Barisal, Barisal, Hizla
Bangladesh, Barisal, Barisal, Mehendiganj
Bangladesh, Barisal, Barisal, Muladi
Bangladesh, Barisal, Barisal, Wazirpur
Bangladesh, Barisal, Bhola, Bhola Sadar
Bangladesh, Barisal, Bhola, Burhanuddin
Bangladesh, Barisal, Bhola, Char Fasson
Bangladesh, Barisal, Bhola, Daulatkhan
Bangladesh, Barisal, Bhola, Lalmohan
Bangladesh, Barisal, Bhola, Manpura
Bangladesh, Barisal, Bhola, Tazumuddin
Bangladesh, Barisal, Jhalokati, Jhalokati Sadar
Bangladesh, Barisal, Jhalokati, Kanthalia
Bangladesh, Barisal, Jhalokati, Nalchity
Bangladesh, Barisal, Jhalokati, Rajapur
Bangladesh, Barisal, Patuakhali, Bauphal
Bangladesh, Barisal, Patuakhali, Dashmina
Bangladesh, Barisal, Patuakhali, Dumki
Bangladesh, Barisal, Patuakhali, Galachipa
Bangladesh, Barisal, Patuakhali, Kala Para
Bangladesh, Barisal, Patuakhali, Mirzaganj
Bangladesh, Barisal, Patuakhali, Patuakhali Sadar
Bangladesh, Barisal, Pirojpur, Bhandaria
Bangladesh, Barisal, Pirojpur, Kawkhali
Bangladesh, Barisal, Pirojpur, Mathbaria
Bangladesh, Barisal, Pirojpur, Nazirpur
Bangladesh, Barisal, Pirojpur, Nesarabad (Swarupkati)
Bangladesh, Barisal, Pirojpur, Pirojpur Sadar
Bangladesh, Barisal, Pirojpur, Zianagar
Bangladesh, Chittagong, Bandarban, Alikadam
Bangladesh, Chittagong, Bandarban, Bandarban Sadar
Bangladesh, Chittagong, Bandarban, Lama
Bangladesh, Chittagong, Bandarban, Naikhongchhari
Bangladesh, Chittagong, Bandarban, Rowangchhari
Bangladesh, Chittagong, Bandarban, Ruma
Bangladesh, Chittagong, Bandarban, Thanchi
Bangladesh, Chittagong, Brahamanbaria, Akhaura
Bangladesh, Chittagong, Brahamanbaria, Ashuganj
Bangladesh, Chittagong, Brahamanbaria, Banchharampur
Bangladesh, Chittagong, Brahamanbaria, Bijoynagar
Bangladesh, Chittagong, Brahamanbaria, Brahmanbaria Sadar
Bangladesh, Chittagong, Brahamanbaria, Kasba
Bangladesh, Chittagong, Brahamanbaria, Nabinagar
Bangladesh, Chittagong, Brahamanbaria, Nasirnagar
Bangladesh, Chittagong, Brahamanbaria, Sarail
Bangladesh, Chittagong, Chandpur, Chandpur Sadar
Bangladesh, Chittagong, Chandpur, Faridganj
Bangladesh, Chittagong, Chandpur, Haim Char
Bangladesh, Chittagong, Chandpur, Hajiganj
Bangladesh, Chittagong, Chandpur, Kachua
Bangladesh, Chittagong, Chandpur, Matlab Dakshin
Bangladesh, Chittagong, Chandpur, Matlab Uttar
Bangladesh, Chittagong, Chandpur, Shahrasti
Bangladesh, Chittagong, Chittagong, Anowara
Bangladesh, Chittagong, Chittagong, Bakalia
Bangladesh, Chittagong, Chittagong, Banshkhali
Bangladesh, Chittagong, Chittagong, Bayejid Bostami
Bangladesh, Chittagong, Chittagong, Boalkhali
Bangladesh, Chittagong, Chittagong, Chandanaish
Bangladesh, Chittagong, Chittagong, Chandgaon
Bangladesh, Chittagong, Chittagong, Chittagong Port
Bangladesh, Chittagong, Chittagong, Double Mooring
Bangladesh, Chittagong, Chittagong, Fatikchhari
Bangladesh, Chittagong, Chittagong, Halishahar
Bangladesh, Chittagong, Chittagong, Hathazari
Bangladesh, Chittagong, Chittagong, Khulshi
Bangladesh, Chittagong, Chittagong, Kotwali
Bangladesh, Chittagong, Chittagong, Lohagara
Bangladesh, Chittagong, Chittagong, Mirsharai
Bangladesh, Chittagong, Chittagong, Pahartali
Bangladesh, Chittagong, Chittagong, Panchlaish
Bangladesh, Chittagong, Chittagong, Patenga
Bangladesh, Chittagong, Chittagong, Patiya
Bangladesh, Chittagong, Chittagong, Rangunia
Bangladesh, Chittagong, Chittagong, Raozan
Bangladesh, Chittagong, Chittagong, Sandwip
Bangladesh, Chittagong, Chittagong, Satkania
Bangladesh, Chittagong, Chittagong, Sitakunda
Bangladesh, Chittagong, Comilla, Barura
Bangladesh, Chittagong, Comilla, Brahman Para
Bangladesh, Chittagong, Comilla, Burichang
Bangladesh, Chittagong, Comilla, Chandina
Bangladesh, Chittagong, Comilla, Chauddagram
Bangladesh, Chittagong, Comilla, Comilla Adarsha Sadar
Bangladesh, Chittagong, Comilla, Comilla Sadar Dakshin
Bangladesh, Chittagong, Comilla, Daudkandi
Bangladesh, Chittagong, Comilla, Debidwar
Bangladesh, Chittagong, Comilla, Homna
Bangladesh, Chittagong, Comilla, Laksam
Bangladesh, Chittagong, Comilla, Manoharganj
Bangladesh, Chittagong, Comilla, Meghna
Bangladesh, Chittagong, Comilla, Muradnagar
Bangladesh, Chittagong, Comilla, Nangalkot
Bangladesh, Chittagong, Comilla, Titas
Bangladesh, Chittagong, Cox'S Bazar, Chakaria
Bangladesh, Chittagong, Cox'S Bazar, Cox'S Bazar Sadar
Bangladesh, Chittagong, Cox'S Bazar, Kutubdia
Bangladesh, Chittagong, Cox'S Bazar, Maheshkhali
Bangladesh, Chittagong, Cox'S Bazar, Pekua
Bangladesh, Chittagong, Cox'S Bazar, Ramu
Bangladesh, Chittagong, Cox'S Bazar, Teknaf
Bangladesh, Chittagong, Cox'S Bazar, Ukhia
Bangladesh, Chittagong, Feni, Chhagalnaiya
Bangladesh, Chittagong, Feni, Daganbhuiyan
Bangladesh, Chittagong, Feni, Feni Sadar
Bangladesh, Chittagong, Feni, Fulgazi
Bangladesh, Chittagong, Feni, Parshuram
Bangladesh, Chittagong, Feni, Sonagazi
Bangladesh, Chittagong, Khagrachhari, Dighinala
Bangladesh, Chittagong, Khagrachhari, Khagrachhari Sadar
Bangladesh, Chittagong, Khagrachhari, Lakshmichhari
Bangladesh, Chittagong, Khagrachhari, Mahalchhari
Bangladesh, Chittagong, Khagrachhari, Manikchhari
Bangladesh, Chittagong, Khagrachhari, Matiranga
Bangladesh, Chittagong, Khagrachhari, Panchhari
Bangladesh, Chittagong, Khagrachhari, Ramgarh
Bangladesh, Chittagong, Lakshmipur, Kamalnagar
Bangladesh, Chittagong, Lakshmipur, Lakshmipur Sadar
Bangladesh, Chittagong, Lakshmipur, Ramganj
Bangladesh, Chittagong, Lakshmipur, Ramgati
Bangladesh, Chittagong, Lakshmipur, Roypur
Bangladesh, Chittagong, Noakhali, Begumganj
Bangladesh, Chittagong, Noakhali, Chatkhil
Bangladesh, Chittagong, Noakhali, Companiganj
Bangladesh, Chittagong, Noakhali, Hatiya
Bangladesh, Chittagong, Noakhali, Kabirhat
Bangladesh, Chittagong, Noakhali, Noakhali Sadar (Sudharam)
Bangladesh, Chittagong, Noakhali, Senbagh
Bangladesh, Chittagong, Noakhali, Sonaimuri
Bangladesh, Chittagong, Noakhali, Subarnachar
Bangladesh, Chittagong, Rangamati, Baghai Chhari
Bangladesh, Chittagong, Rangamati, Barkal
Bangladesh, Chittagong, Rangamati, Belai Chhari
Bangladesh, Chittagong, Rangamati, Jurai Chhari
Bangladesh, Chittagong, Rangamati, Kaptai
Bangladesh, Chittagong, Rangamati, Kawkhali (Betbunia)
Bangladesh, Chittagong, Rangamati, Langadu
Bangladesh, Chittagong, Rangamati, Naniarchar
Bangladesh, Chittagong, Rangamati, Rajasthali
Bangladesh, Chittagong, Rangamati, Rangamati Sadar
Bangladesh, Dhaka, Dhaka, Adabor
Bangladesh, Dhaka, Dhaka, Badda
Bangladesh, Dhaka, Dhaka, Bangshal
Bangladesh, Dhaka, Dhaka, Biman Bandar
Bangladesh, Dhaka, Dhaka, Cantonment
Bangladesh, Dhaka, Dhaka, Chak Bazar
Bangladesh, Dhaka, Dhaka, Dakshinkhan
Bangladesh, Dhaka, Dhaka, Darus Salam
Bangladesh, Dhaka, Dhaka, Demra
Bangladesh, Dhaka, Dhaka, Dhamrai
Bangladesh, Dhaka, Dhaka, Dhanmondi
Bangladesh, Dhaka, Dhaka, Dohar
Bangladesh, Dhaka, Dhaka, Gendaria
Bangladesh, Dhaka, Dhaka, Gulshan
Bangladesh, Dhaka, Dhaka, Hazaribagh
Bangladesh, Dhaka, Dhaka, Jatrabari
Bangladesh, Dhaka, Dhaka, Kadamtali
Bangladesh, Dhaka, Dhaka, Kafrul
Bangladesh, Dhaka, Dhaka, Kalabagan
Bangladesh, Dhaka, Dhaka, Kamrangir Char
Bangladesh, Dhaka, Dhaka, Keraniganj
Bangladesh, Dhaka, Dhaka, Khilgaon
Bangladesh, Dhaka, Dhaka, Khilkhet
Bangladesh, Dhaka, Dhaka, Kotwali
Bangladesh, Dhaka, Dhaka, Lalbagh
Bangladesh, Dhaka, Dhaka, Mirpur
Bangladesh, Dhaka, Dhaka, Mohammadpur
Bangladesh, Dhaka, Dhaka, Motijheel
Bangladesh, Dhaka, Dhaka, Nawabganj
Bangladesh, Dhaka, Dhaka, New Market
Bangladesh, Dhaka, Dhaka, Pallabi
Bangladesh, Dhaka, Dhaka, Paltan
Bangladesh, Dhaka, Dhaka, Ramna
Bangladesh, Dhaka, Dhaka, Rampura
Bangladesh, Dhaka, Dhaka, Sabujbagh
Bangladesh, Dhaka, Dhaka, Savar
Bangladesh, Dhaka, Dhaka, Shah Ali
Bangladesh, Dhaka, Dhaka, Shahbagh
Bangladesh, Dhaka, Dhaka, Sher-e-bangla Nagar
Bangladesh, Dhaka, Dhaka, Shyampur
Bangladesh, Dhaka, Dhaka, Sutrapur
Bangladesh, Dhaka, Dhaka, Tejgaon
Bangladesh, Dhaka, Dhaka, Tejgaon Ind. Area
Bangladesh, Dhaka, Dhaka, Turag
Bangladesh, Dhaka, Dhaka, Uttar Khan
Bangladesh, Dhaka, Dhaka, Uttara
Bangladesh, Dhaka, Faridpur, Alfadanga
Bangladesh, Dhaka, Faridpur, Bhanga
Bangladesh, Dhaka, Faridpur, Boalmari
Bangladesh, Dhaka, Faridpur, Char Bhadrasan
Bangladesh, Dhaka, Faridpur, Faridpur Sadar
Bangladesh, Dhaka, Faridpur, Madhukhali
Bangladesh, Dhaka, Faridpur, Nagarkanda
Bangladesh, Dhaka, Faridpur, Sadarpur
Bangladesh, Dhaka, Faridpur, Saltha
Bangladesh, Dhaka, Gazipur, Gazipur Sadar
Bangladesh, Dhaka, Gazipur, Kaliakair
Bangladesh, Dhaka, Gazipur, Kaliganj
Bangladesh, Dhaka, Gazipur, Kaliganj Paurashava
Bangladesh, Dhaka, Gazipur, Kapasia
Bangladesh, Dhaka, Gazipur, Sreepur
Bangladesh, Dhaka, Gopalganj, Gopalganj Sadar
Bangladesh, Dhaka, Gopalganj, Kashiani
Bangladesh, Dhaka, Gopalganj, Kotali Para
Bangladesh, Dhaka, Gopalganj, Muksudpur
Bangladesh, Dhaka, Gopalganj, Tungi Para
Bangladesh, Dhaka, Jamalpur, Bakshiganj
Bangladesh, Dhaka, Jamalpur, Dewanganj
Bangladesh, Dhaka, Jamalpur, Islampur
Bangladesh, Dhaka, Jamalpur, Jamalpur Sadar
Bangladesh, Dhaka, Jamalpur, Madarganj
Bangladesh, Dhaka, Jamalpur, Melandaha
Bangladesh, Dhaka, Jamalpur, Sarishabari
Bangladesh, Dhaka, Kishoreganj, Austagram
Bangladesh, Dhaka, Kishoreganj, Bajitpur
Bangladesh, Dhaka, Kishoreganj, Bhairab
Bangladesh, Dhaka, Kishoreganj, Hossainpur
Bangladesh, Dhaka, Kishoreganj, Itna
Bangladesh, Dhaka, Kishoreganj, Karimganj
Bangladesh, Dhaka, Kishoreganj, Katiadi
Bangladesh, Dhaka, Kishoreganj, Kishoreganj Sadar
Bangladesh, Dhaka, Kishoreganj, Kuliar Char
Bangladesh, Dhaka, Kishoreganj, Mithamain
Bangladesh, Dhaka, Kishoreganj, Nikli
Bangladesh, Dhaka, Kishoreganj, Pakundia
Bangladesh, Dhaka, Kishoreganj, Tarail
Bangladesh, Dhaka, Madaripur, Kalkini
Bangladesh, Dhaka, Madaripur, Madaripur Sadar
Bangladesh, Dhaka, Madaripur, Rajoir
Bangladesh, Dhaka, Madaripur, Shib Char
Bangladesh, Dhaka, Manikganj, Daulatpur
Bangladesh, Dhaka, Manikganj, Ghior
Bangladesh, Dhaka, Manikganj, Harirampur
Bangladesh, Dhaka, Manikganj, Manikganj Sadar
Bangladesh, Dhaka, Manikganj, Saturia
Bangladesh, Dhaka, Manikganj, Shibalaya
Bangladesh, Dhaka, Manikganj, Singair
Bangladesh, Dhaka, Munshiganj, Gazaria
Bangladesh, Dhaka, Munshiganj, Lohajang
Bangladesh, Dhaka, Munshiganj, Munshiganj Sadar
Bangladesh, Dhaka, Munshiganj, Serajdikhan
Bangladesh, Dhaka, Munshiganj, Sreenagar
Bangladesh, Dhaka, Munshiganj, Tongibari
Bangladesh, Dhaka, Mymensingh, Bhaluka
Bangladesh, Dhaka, Mymensingh, Dhobaura
Bangladesh, Dhaka, Mymensingh, Fulbaria
Bangladesh, Dhaka, Mymensingh, Gaffargaon
Bangladesh, Dhaka, Mymensingh, Gauripur
Bangladesh, Dhaka, Mymensingh, Haluaghat
Bangladesh, Dhaka, Mymensingh, Ishwarganj
Bangladesh, Dhaka, Mymensingh, Muktagachha
Bangladesh, Dhaka, Mymensingh, Mymensingh Sadar
Bangladesh, Dhaka, Mymensingh, Nandail
Bangladesh, Dhaka, Mymensingh, Phulpur
Bangladesh, Dhaka, Mymensingh, Trishal
Bangladesh, Dhaka, Narayanganj, Araihazar
Bangladesh, Dhaka, Narayanganj, Bandar
Bangladesh, Dhaka, Narayanganj, Narayanganj Sadar
Bangladesh, Dhaka, Narayanganj, Rupganj
Bangladesh, Dhaka, Narayanganj, Sonargaon
Bangladesh, Dhaka, Narsingdi, Belabo
Bangladesh, Dhaka, Narsingdi, Manohardi
Bangladesh, Dhaka, Narsingdi, Narsingdi Sadar
Bangladesh, Dhaka, Narsingdi, Palash
Bangladesh, Dhaka, Narsingdi, Roypura
Bangladesh, Dhaka, Narsingdi, Shibpur
Bangladesh, Dhaka, Netrakona, Atpara
Bangladesh, Dhaka, Netrakona, Barhatta
Bangladesh, Dhaka, Netrakona, Durgapur
Bangladesh, Dhaka, Netrakona, Kalmakanda
Bangladesh, Dhaka, Netrakona, Kendua
Bangladesh, Dhaka, Netrakona, Khaliajuri
Bangladesh, Dhaka, Netrakona, Madan
Bangladesh, Dhaka, Netrakona, Mohanganj
Bangladesh, Dhaka, Netrakona, Netrokona Sadar
Bangladesh, Dhaka, Netrakona, Purbadhala
Bangladesh, Dhaka, Rajbari, Balia Kandi
Bangladesh, Dhaka, Rajbari, Goalandaghat
Bangladesh, Dhaka, Rajbari, Kalukhali
Bangladesh, Dhaka, Rajbari, Pangsha
Bangladesh, Dhaka, Rajbari, Rajbari Sadar
Bangladesh, Dhaka, Shariatpur, Bhedarganj
Bangladesh, Dhaka, Shariatpur, Damudya
Bangladesh, Dhaka, Shariatpur, Gosairhat
Bangladesh, Dhaka, Shariatpur, Naria
Bangladesh, Dhaka, Shariatpur, Shariatpur Sadar
Bangladesh, Dhaka, Shariatpur, Zanjira
Bangladesh, Dhaka, Sherpur, Jhenaigati
Bangladesh, Dhaka, Sherpur, Nakla
Bangladesh, Dhaka, Sherpur, Nalitabari
Bangladesh, Dhaka, Sherpur, Sherpur Sadar
Bangladesh, Dhaka, Sherpur, Sreebardi
Bangladesh, Dhaka, Tangail, Basail
Bangladesh, Dhaka, Tangail, Bhuapur
Bangladesh, Dhaka, Tangail, Delduar
Bangladesh, Dhaka, Tangail, Dhanbari
Bangladesh, Dhaka, Tangail, Ghatail
Bangladesh, Dhaka, Tangail, Gopalpur
Bangladesh, Dhaka, Tangail, Kalihati
Bangladesh, Dhaka, Tangail, Madhupur
Bangladesh, Dhaka, Tangail, Mirzapur
Bangladesh, Dhaka, Tangail, Nagarpur
Bangladesh, Dhaka, Tangail, Sakhipur
Bangladesh, Dhaka, Tangail, Tangail Sadar
Bangladesh, Khulna, Bagerhat, Bagerhat Sadar
Bangladesh, Khulna, Bagerhat, Chitalmari
Bangladesh, Khulna, Bagerhat, Fakirhat
Bangladesh, Khulna, Bagerhat, Kachua
Bangladesh, Khulna, Bagerhat, Mollahat
Bangladesh, Khulna, Bagerhat, Mongla
Bangladesh, Khulna, Bagerhat, Morrelganj
Bangladesh, Khulna, Bagerhat, Rampal
Bangladesh, Khulna, Bagerhat, Sarankhola
Bangladesh, Khulna, Chuadanga, Alamdanga
Bangladesh, Khulna, Chuadanga, Chuadanga Sadar
Bangladesh, Khulna, Chuadanga, Damurhuda
Bangladesh, Khulna, Chuadanga, Jiban Nagar
Bangladesh, Khulna, Jessore, Abhaynagar
Bangladesh, Khulna, Jessore, Bagher Para
Bangladesh, Khulna, Jessore, Chaugachha
Bangladesh, Khulna, Jessore, Jhikargachha
Bangladesh, Khulna, Jessore, Keshabpur
Bangladesh, Khulna, Jessore, Kotwali
Bangladesh, Khulna, Jessore, Manirampur
Bangladesh, Khulna, Jessore, Sharsha
Bangladesh, Khulna, Jhenaidah, Harinakunda
Bangladesh, Khulna, Jhenaidah, Jhenaidah Sadar
Bangladesh, Khulna, Jhenaidah, Kaliganj
Bangladesh, Khulna, Jhenaidah, Kotchandpur
Bangladesh, Khulna, Jhenaidah, Maheshpur
Bangladesh, Khulna, Jhenaidah, Shailkupa
Bangladesh, Khulna, Khulna, Batiaghata
Bangladesh, Khulna, Khulna, Dacope
Bangladesh, Khulna, Khulna, Daulatpur
Bangladesh, Khulna, Khulna, Dighalia
Bangladesh, Khulna, Khulna, Dumuria
Bangladesh, Khulna, Khulna, Khalishpur
Bangladesh, Khulna, Khulna, Khan Jahan Ali
Bangladesh, Khulna, Khulna, Khulna Sadar
Bangladesh, Khulna, Khulna, Koyra
Bangladesh, Khulna, Khulna, Paikgachha
Bangladesh, Khulna, Khulna, Phultala
Bangladesh, Khulna, Khulna, Rupsa
Bangladesh, Khulna, Khulna, Sonadanga
Bangladesh, Khulna, Khulna, Terokhada
Bangladesh, Khulna, Kushtia, Bheramara
Bangladesh, Khulna, Kushtia, Daulatpur
Bangladesh, Khulna, Kushtia, Khoksa
Bangladesh, Khulna, Kushtia, Kumarkhali
Bangladesh, Khulna, Kushtia, Kushtia Sadar
Bangladesh, Khulna, Kushtia, Mirpur
Bangladesh, Khulna, Magura, Magura Sadar
Bangladesh, Khulna, Magura, Mohammadpur
Bangladesh, Khulna, Magura, Shalikha
Bangladesh, Khulna, Magura, Sreepur
Bangladesh, Khulna, Meherpur, Gangni
Bangladesh, Khulna, Meherpur, Meherpur Sadar
Bangladesh, Khulna, Meherpur, Mujib Nagar
Bangladesh, Khulna, Narail, Kalia
Bangladesh, Khulna, Narail, Lohagara
Bangladesh, Khulna, Narail, Narail Sadar
Bangladesh, Khulna, Satkhira, Assasuni
Bangladesh, Khulna, Satkhira, Debhata
Bangladesh, Khulna, Satkhira, Kalaroa
Bangladesh, Khulna, Satkhira, Kaliganj
Bangladesh, Khulna, Satkhira, Satkhira Sadar
Bangladesh, Khulna, Satkhira, Shyamnagar
Bangladesh, Khulna, Satkhira, Tala
Bangladesh, Rajshahi, Bogra, Adamdighi
Bangladesh, Rajshahi, Bogra, Bogra Sadar
Bangladesh, Rajshahi, Bogra, Dhunat
Bangladesh, Rajshahi, Bogra, Dhupchanchia
Bangladesh, Rajshahi, Bogra, Gabtali
Bangladesh, Rajshahi, Bogra, Kahaloo
Bangladesh, Rajshahi, Bogra, Nandigram
Bangladesh, Rajshahi, Bogra, Sariakandi
Bangladesh, Rajshahi, Bogra, Shajahanpur
Bangladesh, Rajshahi, Bogra, Sherpur
Bangladesh, Rajshahi, Bogra, Shibganj
Bangladesh, Rajshahi, Bogra, Sonatola
Bangladesh, Rajshahi, Joypurhat, Akkelpur
Bangladesh, Rajshahi, Joypurhat, Joypurhat Sadar
Bangladesh, Rajshahi, Joypurhat, Kalai
Bangladesh, Rajshahi, Joypurhat, Khetlal
Bangladesh, Rajshahi, Joypurhat, Panchbibi
Bangladesh, Rajshahi, Naogaon, Atrai
Bangladesh, Rajshahi, Naogaon, Badalgachhi
Bangladesh, Rajshahi, Naogaon, Dhamoirhat
Bangladesh, Rajshahi, Naogaon, Mahadebpur
Bangladesh, Rajshahi, Naogaon, Manda
Bangladesh, Rajshahi, Naogaon, Naogaon Sadar
Bangladesh, Rajshahi, Naogaon, Niamatpur
Bangladesh, Rajshahi, Naogaon, Patnitala
Bangladesh, Rajshahi, Naogaon, Porsha
Bangladesh, Rajshahi, Naogaon, Raninagar
Bangladesh, Rajshahi, Naogaon, Sapahar
Bangladesh, Rajshahi, Natore, Bagati Para
Bangladesh, Rajshahi, Natore, Baraigram
Bangladesh, Rajshahi, Natore, Gurudaspur
Bangladesh, Rajshahi, Natore, Lalpur
Bangladesh, Rajshahi, Natore, Natore Sadar
Bangladesh, Rajshahi, Natore, Singra
Bangladesh, Rajshahi, Nawabganj, Bholahat
Bangladesh, Rajshahi, Nawabganj, Gomastapur
Bangladesh, Rajshahi, Nawabganj, Nachole
Bangladesh, Rajshahi, Nawabganj, Nawabganj Sadar
Bangladesh, Rajshahi, Nawabganj, Shibganj
Bangladesh, Rajshahi, Pabna, Atgharia
Bangladesh, Rajshahi, Pabna, Bera
Bangladesh, Rajshahi, Pabna, Bhangura
Bangladesh, Rajshahi, Pabna, Chatmohar
Bangladesh, Rajshahi, Pabna, Faridpur
Bangladesh, Rajshahi, Pabna, Ishwardi
Bangladesh, Rajshahi, Pabna, Pabna Sadar
Bangladesh, Rajshahi, Pabna, Santhia
Bangladesh, Rajshahi, Pabna, Sujanagar
Bangladesh, Rajshahi, Rajshahi, Bagha
Bangladesh, Rajshahi, Rajshahi, Baghmara
Bangladesh, Rajshahi, Rajshahi, Boalia
Bangladesh, Rajshahi, Rajshahi, Charghat
Bangladesh, Rajshahi, Rajshahi, Durgapur
Bangladesh, Rajshahi, Rajshahi, Godagari
Bangladesh, Rajshahi, Rajshahi, Matihar
Bangladesh, Rajshahi, Rajshahi, Mohanpur
Bangladesh, Rajshahi, Rajshahi, Paba
Bangladesh, Rajshahi, Rajshahi, Puthia
Bangladesh, Rajshahi, Rajshahi, Rajpara
Bangladesh, Rajshahi, Rajshahi, Shah Makhdum
Bangladesh, Rajshahi, Rajshahi, Tanore
Bangladesh, Rajshahi, Sirajganj, Belkuchi
Bangladesh, Rajshahi, Sirajganj, Chauhali
Bangladesh, Rajshahi, Sirajganj, Kamarkhanda
Bangladesh, Rajshahi, Sirajganj, Kazipur
Bangladesh, Rajshahi, Sirajganj, Royganj
Bangladesh, Rajshahi, Sirajganj, Shahjadpur
Bangladesh, Rajshahi, Sirajganj, Sirajganj Sadar
Bangladesh, Rajshahi, Sirajganj, Tarash
Bangladesh, Rajshahi, Sirajganj, Ullah Para
Bangladesh, Rangpur, Dinajpur, Biral
Bangladesh, Rangpur, Dinajpur, Birampur
Bangladesh, Rangpur, Dinajpur, Birganj
Bangladesh, Rangpur, Dinajpur, Bochaganj
Bangladesh, Rangpur, Dinajpur, Chirirbandar
Bangladesh, Rangpur, Dinajpur, Dinajpur Sadar
Bangladesh, Rangpur, Dinajpur, Fulbari
Bangladesh, Rangpur, Dinajpur, Ghoraghat
Bangladesh, Rangpur, Dinajpur, Hakimpur
Bangladesh, Rangpur, Dinajpur, Kaharole
Bangladesh, Rangpur, Dinajpur, Khansama
Bangladesh, Rangpur, Dinajpur, Nawabganj
Bangladesh, Rangpur, Dinajpur, Parbatipur
Bangladesh, Rangpur, Gaibandha, Fulchhari
Bangladesh, Rangpur, Gaibandha, Gaibandha Sadar
Bangladesh, Rangpur, Gaibandha, Gobindaganj
Bangladesh, Rangpur, Gaibandha, Palashbari
Bangladesh, Rangpur, Gaibandha, Sadullapur
Bangladesh, Rangpur, Gaibandha, Saghatta
Bangladesh, Rangpur, Gaibandha, Sundarganj
Bangladesh, Rangpur, Kurigram, Bhurungamari
Bangladesh, Rangpur, Kurigram, Char Rajibpur
Bangladesh, Rangpur, Kurigram, Chilmari
Bangladesh, Rangpur, Kurigram, Kurigram Sadar
Bangladesh, Rangpur, Kurigram, Nageshwari
Bangladesh, Rangpur, Kurigram, Phulbari
Bangladesh, Rangpur, Kurigram, Rajarhat
Bangladesh, Rangpur, Kurigram, Raumari
Bangladesh, Rangpur, Kurigram, Ulipur
Bangladesh, Rangpur, Lalmonirhat, Aditmari
Bangladesh, Rangpur, Lalmonirhat, Hatibandha
Bangladesh, Rangpur, Lalmonirhat, Kaliganj
Bangladesh, Rangpur, Lalmonirhat, Lalmonirhat Sadar
Bangladesh, Rangpur, Lalmonirhat, Patgram
Bangladesh, Rangpur, Nilphamari, Dimla
Bangladesh, Rangpur, Nilphamari, Domar
Bangladesh, Rangpur, Nilphamari, Jaldhaka
Bangladesh, Rangpur, Nilphamari, Kishoreganj
Bangladesh, Rangpur, Nilphamari, Nilphamari Sadar
Bangladesh, Rangpur, Nilphamari, Saidpur
Bangladesh, Rangpur, Panchagarh, Atwari
Bangladesh, Rangpur, Panchagarh, Boda
Bangladesh, Rangpur, Panchagarh, Debiganj
Bangladesh, Rangpur, Panchagarh, Panchagarh Sadar
Bangladesh, Rangpur, Panchagarh, Tentulia
Bangladesh, Rangpur, Rangpur, Badarganj
Bangladesh, Rangpur, Rangpur, Gangachara
Bangladesh, Rangpur, Rangpur, Kaunia
Bangladesh, Rangpur, Rangpur, Mitha Pukur
Bangladesh, Rangpur, Rangpur, Pirgachha
Bangladesh, Rangpur, Rangpur, Pirganj
Bangladesh, Rangpur, Rangpur, Rangpur Sadar
Bangladesh, Rangpur, Rangpur, Taraganj
Bangladesh, Rangpur, Thakurgaon, Baliadangi
Bangladesh, Rangpur, Thakurgaon, Haripur
Bangladesh, Rangpur, Thakurgaon, Pirganj
Bangladesh, Rangpur, Thakurgaon, Ranisankail
Bangladesh, Rangpur, Thakurgaon, Thakurgaon Sadar
Bangladesh, Sylhet, Habiganj, Ajmiriganj
Bangladesh, Sylhet, Habiganj, Bahubal
Bangladesh, Sylhet, Habiganj, Baniachong
Bangladesh, Sylhet, Habiganj, Chunarughat
Bangladesh, Sylhet, Habiganj, Habiganj Sadar
Bangladesh, Sylhet, Habiganj, Lakhai
Bangladesh, Sylhet, Habiganj, Madhabpur
Bangladesh, Sylhet, Habiganj, Nabiganj
Bangladesh, Sylhet, Maulvibazar, Barlekha
Bangladesh, Sylhet, Maulvibazar, Juri
Bangladesh, Sylhet, Maulvibazar, Kamalganj
Bangladesh, Sylhet, Maulvibazar, Kulaura
Bangladesh, Sylhet, Maulvibazar, Maulvi Bazar Sadar
Bangladesh, Sylhet, Maulvibazar, Rajnagar
Bangladesh, Sylhet, Maulvibazar, Sreemangal
Bangladesh, Sylhet, Sunamganj, Bishwambarpur
Bangladesh, Sylhet, Sunamganj, Chhatak
Bangladesh, Sylhet, Sunamganj, Dakshin Sunamganj
Bangladesh, Sylhet, Sunamganj, Derai
Bangladesh, Sylhet, Sunamganj, Dharampasha
Bangladesh, Sylhet, Sunamganj, Dowarabazar
Bangladesh, Sylhet, Sunamganj, Jagannathpur
Bangladesh, Sylhet, Sunamganj, Jamalganj
Bangladesh, Sylhet, Sunamganj, Sulla
Bangladesh, Sylhet, Sunamganj, Sunamganj Sadar
Bangladesh, Sylhet, Sunamganj, Tahirpur
Bangladesh, Sylhet, Sylhet, Balaganj
Bangladesh, Sylhet, Sylhet, Beani Bazar
Bangladesh, Sylhet, Sylhet, Bishwanath
Bangladesh, Sylhet, Sylhet, Companiganj
Bangladesh, Sylhet, Sylhet, Dakshin Surma
Bangladesh, Sylhet, Sylhet, Fenchuganj
Bangladesh, Sylhet, Sylhet, Golabganj
Bangladesh, Sylhet, Sylhet, Gowainghat
Bangladesh, Sylhet, Sylhet, Jaintiapur
Bangladesh, Sylhet, Sylhet, Kanaighat
Bangladesh, Sylhet, Sylhet, Sylhet Sadar
Bangladesh, Sylhet, Sylhet, Zakiganj
