Admin Level 0,Admin Level 1,Admin Level 2,Admin Level 3,
Haiti, Centre, Cerca La Source, Cerca La Source
Haiti, Centre, Cerca La Source, Thomasique
Haiti, Centre, Hinche, Cerca Carvajal
Haiti, Centre, Hinche, Hinche
Haiti, Centre, Hinche, Maïssade
Haiti, Centre, Hinche, Thomonde
Haiti, Centre, Lascahobas, Belladère
Haiti, Centre, Lascahobas, Lascahobas
Haiti, Centre, Lascahobas, Savanette
Haiti, Centre, Mirebalais, Boucan-Carré
Haiti, Centre, Mirebalais, Mirebalais
Haiti, Centre, Mirebalais, Saut-d'Eau
Haiti, Grand'Anse, Anse d'Hainault, Anse d'Hainault
Haiti, Grand'Anse, Anse d'Hainault, Dame Marie
Haiti, Grand'Anse, Anse d'Hainault, Les Irois
Haiti, Grand'Anse, Corail, Beaumont
Haiti, Grand'Anse, Corail, Corail
Haiti, Grand'Anse, Corail, Pestel
Haiti, Grand'Anse, Corail, Roseaux
Haiti, Grand'Anse, Jérémie, Abricots
Haiti, Grand'Anse, Jérémie, Bonbon
Haiti, Grand'Anse, Jérémie, Chambellan
Haiti, Grand'Anse, Jérémie, Jérémie
Haiti, Grand'Anse, Jérémie, Moron
Haiti, L'Artibonite, Dessalines, Desdunes
Haiti, L'Artibonite, Dessalines, Dessalines
Haiti, L'Artibonite, Dessalines, Grande Saline
Haiti, L'Artibonite, Dessalines, Petite Rivière de l'Artibonite
Haiti, L'Artibonite, Gros-Morne, Anse Rouge
Haiti, L'Artibonite, Gros-Morne, Gros-Morne
Haiti, L'Artibonite, Gros-Morne, Terre Neuve
Haiti, L'Artibonite, les Gonaïves, Ennery
Haiti, L'Artibonite, les Gonaïves, Gonaïves
Haiti, L'Artibonite, les Gonaïves, L'Estère
Haiti, L'Artibonite, Marmelade, Marmelade
Haiti, L'Artibonite, Marmelade, Saint Michel de l'Attalaye
Haiti, L'Artibonite, Saint-Marc, La Chapelle
Haiti, L'Artibonite, Saint-Marc, Saint-Marc
Haiti, L'Artibonite, Saint-Marc, Verettes
Haiti, Nippes, l'Anse-à-Veau, Anse-à-Veau
Haiti, Nippes, l'Anse-à-Veau, Baraderes
Haiti, Nippes, l'Anse-à-Veau, L'Azile
Haiti, Nippes, l'Anse-à-Veau, Petit Trou de Nippes
Haiti, Nippes, Miragoâne, Miragoâne
Haiti, Nippes, Miragoâne, Petite Rivière de Nippes
Haiti, Nord, Borgne, Borgne
Haiti, Nord, Borgne, La Victoire
Haiti, Nord, Borgne, Pignon
Haiti, Nord, Borgne, Port-Margot
Haiti, Nord, Borgne, Ranquitte
Haiti, Nord, Grande-Rivière du Nord, Bahon
Haiti, Nord, Grande-Rivière du Nord, Grand Rivière du Nord
Haiti, Nord, l'Acul-du-Nord, Acul du Nord
Haiti, Nord, l'Acul-du-Nord, Milot
Haiti, Nord, l'Acul-du-Nord, Plaine du Nord
Haiti, Nord, le Cap-Haïtien, Cap-Haïtien
Haiti, Nord, le Cap-Haïtien, Limonade
Haiti, Nord, le Cap-Haïtien, Quartier Morin
Haiti, Nord, le Limbé, Bas Limbé
Haiti, Nord, le Limbé, Limbé
Haiti, Nord, Plaisance, Pilate
Haiti, Nord, Plaisance, Plaisance
Haiti, Nord, Saint-Raphaël, Dondon
Haiti, Nord, Saint-Raphaël, Saint-Raphaël
Haiti, Nord-Est, Fort-Liberté, Fort-Liberté
Haiti, Nord-Est, Fort-Liberté, Perches
Haiti, Nord-Est, Fort-Liberté, Terrier
Haiti, Nord-Est, le Trou-du-Nord, Caracol
Haiti, Nord-Est, le Trou-du-Nord, Sainte Suzanne
Haiti, Nord-Est, le Trou-du-Nord, Terrier Rouge
Haiti, Nord-Est, le Trou-du-Nord, Trou du Nord
Haiti, Nord-Est, Ouanaminthe, Capotille
Haiti, Nord-Est, Ouanaminthe, Mont-Organisé
Haiti, Nord-Est, Ouanaminthe, Ouanaminthe
Haiti, Nord-Est, Vallières, Carice
Haiti, Nord-Est, Vallières, Mombin Crochu
Haiti, Nord-Est, Vallières, Vallières
Haiti, Nord-Ouest, Môle Saint-Nicolas, Baie de Henne
Haiti, Nord-Ouest, Môle Saint-Nicolas, Bombardopolis
Haiti, Nord-Ouest, Môle Saint-Nicolas, Jean-Rabel
Haiti, Nord-Ouest, Môle Saint-Nicolas, Môle Saint Nicholas
Haiti, Nord-Ouest, Port-de-Paix, Bassin Bleu
Haiti, Nord-Ouest, Port-de-Paix, Chansolme
Haiti, Nord-Ouest, Port-de-Paix, La Tortue
Haiti, Nord-Ouest, Port-de-Paix, Port-de-Paix
Haiti, Nord-Ouest, Saint-Louis du Nord, Anse-à-Foleur
Haiti, Nord-Ouest, Saint-Louis du Nord, Saint Louis du Nord
Haiti, Ouest, Croix-des-Bouquets, Cornillon
Haiti, Ouest, Croix-des-Bouquets, Croix-des Bouquets
Haiti, Ouest, Croix-des-Bouquets, Fonds-Verettes
Haiti, Ouest, Croix-des-Bouquets, Ganthier
Haiti, Ouest, Croix-des-Bouquets, Thomazeau
Haiti, Ouest, La Gonâve, Anse-à-Galets
Haiti, Ouest, La Gonâve, Pointe-à-Raquette
Haiti, Ouest, l'Arcahaie, Arcahaie
Haiti, Ouest, l'Arcahaie, Cabaret
Haiti, Ouest, Léogâne, Grand-Goâve
Haiti, Ouest, Léogâne, Léogâne
Haiti, Ouest, Léogâne, Petit-Goâve
Haiti, Ouest, Port-au-Prince, Carrefour
Haiti, Ouest, Port-au-Prince, Delmas
Haiti, Ouest, Port-au-Prince, Grenier
Haiti, Ouest, Port-au-Prince, Kenscoff
Haiti, Ouest, Port-au-Prince, Pétion-Ville
Haiti, Ouest, Port-au-Prince, Port-au-Prince
Haiti, Sud, Aquin, Aquin
Haiti, Sud, Aquin, Cavaillon
Haiti, Sud, Aquin, Saint-Jean du Sud
Haiti, Sud, Aquin, Saint-Louis du Sud
Haiti, Sud, les Cayes, Camp Perrin
Haiti, Sud, les Cayes, Chantal
Haiti, Sud, les Cayes, Ile à Vache
Haiti, Sud, les Cayes, Les Cayes
Haiti, Sud, les Cayes, Maniche
Haiti, Sud, les Cayes, Torbeck
Haiti, Sud, les Chardonnières, Chardonnières
Haiti, Sud, les Chardonnières, Les Anglais
Haiti, Sud, les Chardonnières, Tiburon
Haiti, Sud, les Côteaux, Côteaux
Haiti, Sud, les Côteaux, Port-A-Piment
Haiti, Sud, les Côteaux, Roche-à-Bateau
Haiti, Sud, Port-Salut, Arniquet
Haiti, Sud, Port-Salut, Port-Salut
Haiti, Sud, Port-Salut, Saint-Jean du Sud
Haiti, Sud-Est, Bainet, Bainet
Haiti, Sud-Est, Bainet, Côtes-de-Fer
Haiti, Sud-Est, Belle-Anse, Anse-à-Pitre
Haiti, Sud-Est, Belle-Anse, Belle-Anse
Haiti, Sud-Est, Belle-Anse, Grand Gosier
Haiti, Sud-Est, Belle-Anse, Thiotte
Haiti, Sud-Est, Jacmel, Cayes Jacmel
Haiti, Sud-Est, Jacmel, Cayes-Jacmel
Haiti, Sud-Est, Jacmel, Jacmel
Haiti, Sud-Est, Jacmel, Marigot
